Title,Content,Cluster,Concept
Arecuna - Pleiades.txt,"Jilijoaibu's mother-in-law used to feed her son-in-law on fish taken from her uterus. When he discovered her trick, Jilijoaibu broke crystals and threw the fragments onto the bank where his mother-in-law was in the habit of going, but took care to conceal them under banana-tree leaves. The mother-in-law tripped and fell; the stones cut her arms and legs and the whole of her body. She died. The stones leaped into the water and turned into ""piranhas,"" which for this reason have remained cannibalistic. The old woman's liver also fell nto the water and floated on the surface. It can still be seen in the form of mureru brava, an aquatic plant with red leaves, the seed of which is the old woman's heart.",15,Pleiades
Sherente - Venus.txt,"Venus (a masculine personage) was living in human shape among men. His body was covered with malodorous ulcers, and behind him was buzzing a swarm of bees. All the people turned up their noses when he passed, and refused him when he asked permission to rest in their houses. Only the Indian, Wainkaura, made the poor wretch welcome and gave him a new mat on which to sit. He asked his guest whence he came and whither he was bound. Venus explained that he had lost his way. Wainkaura ordered hot water to be brought to him so that he could wash Venus' ulcers and, ignoring his guest's protests, insisted that this should take place inside the hut, and not outdoors. He even ordered his virgin daughter to let Venus sit on her bare thighs, and washed him in this position. Thus the visitor recovered. After nightfall the visitor said to Wainkaura, ""What would you like to have?"" and as Wainkaura did not understand, he explained, ""Do you want to live or to die? Waptokwa is angry over the mutual massacring of the Indians. They have even pierced little children with arrows. So it would be better to destroy all of them at once. But tell no one and quickly pack up your belongings."" He ordered Wainkaura to kill the juruty dove (Leptoptila rufaxilla). When Wainkaura returned with the dove, Venus said that he had deflowered his daughter, and offered to pay compensation. However, Wainkaura refused to accept anything. By means of the dove's carcass, Venus made a large boat in which Wainkaura took his place along with his family. Venus took leave and departed, a whirlwind lifted him up to the sky. At once a distant noise became audible. Then the flood came and carried them all away. Before long, all drowned or died from hunger. Only Wainkaura and his family escaped.",18,God
Kraho - Autxepirire.txt,"An Indian whose wife was unfaithful to him decided to leave her and go far away. He took with him his sons and his daughter who was the youngest of all his children. Hardly had they entered the forest when the men turned into deer in order to advance more rapidly, but the little girl was unable to imitate them. They met the ogre Autxepirire, who was fishing with timbo (a fish poison), and the men turned into diving birds in order to steal his fish from him. Once again the little girl did not succeed in imitating them and went imprudently up to the ogre, who, on seeing her, fell in love with her and asked for her hand in marriage. Since he wished to be as prettily painted as his fiancee, the men told him that he must allow himself to be roasted in the fire. The ogre agreed to this and was burned to death. The little girl noticed that she had left a gourd (a bracelet, in another version) behind near the fire, and she came back to get it. She stirred up the embers and took out a piece of the ogre's penis. The ogre, as it happened, was on the point of rising again from its ashes. The girl ran off, pursued by the monster. Two rivers barred her path. She crossed each one in turn on the back of an alligator, who agreed to play the part of ferryman on condition that the little girl would insult him immediately afterward (sic). In spite of his promises, he ran after her in order to eat her. The heroine took refuge first of all with a rhea (etna), then with wasps who hid her in their nest. She finally rejoined her family, and with some difficulty all eventually escaped from the Autxepirire cannibal spirits, who attacked them in the tree where they had taken refuge. They succeeded in cutting the rope up which their persecutors were climbing. The latter fell to the ground and changed into crabs. Again lost and abandoned, the little girl arrived at a village belonging to the seriemas, the urubus, and the vultures. She hid near a spring, and by spitting on the gourds with which the birds came to draw water, she broke them all- To take their revenge, the birds formed into a flock and forced her to undergo gang rape, sparing neither her eyes, her ears, her nostrils, or the spaces between her toes. . . . Having thus been made ""rotten"" with caresses, the young girl died, and the animals dismembered her body. Each one chose a piece of the vulva and hung it on a perch, to the accompaniment of magic words. At once each piece grew and covered the roof of the hut. The hawk, who had been the first to help himself, had a fine house, but the urubu's share remained small, dry, and shriveled.",21,Adventure
Vapidiana - Fish Poison.txt,"A woman handed over her child to be brought up by a fox. But as the child cried a great deal, the fox got rid of it by passing it on to a female tapir. When the boy grew up, the tapir married him. She soon became pregnant and begged her husband to shoot her with his arrows and remove the child from her corpse. Having obeyed her instructions, the man discovered that every time he washed the child in the river, the fish died. And when the child died, it turned into timbo-aiyare, from which fish poison is extracted.",16,FishPoison
Arawak - Fish Poison.txt,"An old man who was fond of fishing one day took his son with him to the river. Wherever the lad swam, the fish died. And yet he could safely eat them. The father took the lad with him to bathe day by day till the fish knew of his plans and resolved to defeat him. They made up their minds to slay the boy. They dared not attack him in the water, so they chose an old log as the scene of the slaughter where the boy, after swimming, would bask in the sun. There the fish attacked him, and the stingray fatally wounded him. The father carried his son into the forest. When the dying youth saw his blood drop on the ground, he told his father of the curious plants that would grow wherever his blood took root, and he forecast that the roots of these plants would avenge his death.",16,FishPoison
Anazonia - Amao.txt,"There was once a young virgin girl called Amao. Having been accidentally fertilized by a fish which got inside her vulva, she gave birth to a boy. When the baby was two months old, she happened to lay him down on a stone while she was catching small fish. Toward midday she went to pick him up again, but the child was dead. She wept all night. In the morning the child started to talk and explained that the animals had killed him by frightening him. If his mother wanted to be safe from their attacks, she should smoke them with a resin fire until they changed into stones. When evening came, Amao buried her son. At midnight all the animals had turned into stones, except the great snake, the stingray, the wild pig, and the tapir who had gone off in the direction of the spring where the child had died. Amao went there, killed the wild pig and the tapir, cut them up, and threw all the flesh into the stream, apart from a thigh belonging to each animal, which she laid on the rock where they turned into stone. Next, by means of a lasso, she captured the great snake and the stingray which were feeding on the bed of the stream. She turned them into stones with the help of resin. Then she went back to her own people to teach them cooking and the arts of civilization. After which she disappeared, and no one knows where she went.",13,Cultivation
Mundurucu - Cultivation.txt,"Formerly there were neither gardens nor cultivated plants. An old woman was pestered by her young nephew, who was hungry and was asking for agricultural produce which did not yet exist. She had a section of the forest cleared and burned and informed men of all that would grow there: maize, sweet potatoes, sugar canes, bananas, sweet manioc, cara, melons, cashew nuts, inga pods, fava and feijao. . . . And she explained when each plant should be harvested, and how it should be cooked and flavored. But she also explained that timbo (fish poison) was poisonous and should not be eaten. Men should pull it up, grind it in water, and invite everybody to share the dead fish which, unlike the timbo, could be eaten. he had herself buried in the garden, and from her body sprang all of the plants.",13,Cultivation
Kachuyana - Curare.txt,"There was once a young bachelor who lived a long way from his tribe's people in a lonely hut. On returning from a particularly successful hunt, he cooked all the game and ate it, except for a female howler monkey, which he put on to smoke overnight. Then he went to bed. On waking up next morning, he resolved to eat the monkey before setting off to hunt, but when he saw the body with the hair all burned off, he experienced a feeling of revulsion, then of anger: ""What is this she-monkey to me? I am hungry and cannot eat it!"" But he left it to smoke, and went off to hunt. In the evening he ate the game he had killed during the day and said, ""Tomorrow I will eat the she-monkey. . . ."" But when the next day came, the same scene occurred; he had only to glance at the she-monkey, and any desire to eat her vanished, so plump and pretty did she seem. After a final glance at the monkey he sighed, ""If only she could change into a wife for me!"" When he returned from hunting, the meal was ready—meat, soup, pancakes . . . and the same was true the next day, when he got back from fishing. The Indian was puzzled and started looking everywhere, until finally he discovered a charming woman lying in his hammock; she told him that she was the she-monkey he had wished for as a wife. After the honeymoon the man brought the woman to the village in order to introduce her to his relatives. Then it was the woman's turn to present her husband to her people—a family of monkeys whose hut was at the top of a tree. The woman helped the man to climb up into it; the next morning she went off with the other monkeys. Neither she nor they ever came back, and the man, who could not climb down unaided, remained marooned at the top of the tree. One morning, the king vulture happened to be passing by. He questioned the man, who told him his story and explained the difficult situation he was in. ""Wait a moment,"" said the vulture as he forced himself to produce a sneeze. From his nose there spurted (nasal) mucus which stretched to the ground and changed into a creeper. However, the creeper was so slender that the man said it might snap under his weight. The vulture thereupon called upon the harpy eagle which also sneezed and whose threads of mucus formed a stronger creeper, down which the hero was able to slide. Before leaving, the harpy eagle told him how to take his revenge. He should cut the liana known as ""the harpy eagle's arrow"" and make it ready in accordance with its instructions and, having duly invoked his protector, go off and hunt the howler monkeys. The man did as he was told. All the howler monkeys were killed, except one little one, from which present-day monkeys are descended.",21,Adventure
Ge - Destructive Fire.txt,"Long before men existed, Sun and Moon lived on the earth. One day, unknown to his brother, Sun set off into the savannah (or steppe) and arrived at the ""foot of the sky"" (Kraho). There he heard the characteristic sound of the woodpeckers piercing the bark of the trees with their beaks. One of the birds had just made a red head ornament of feathers, which gleamed like fire. Sun asked the bird for the headdress, and the latter agreed to give it to him but warned Sun that he would throw it down from the top of the tree; Sun must catch it as it fell and not allow it to touch the ground. The red feather crown came whirling down, nickering so brightly that it looked like real fire. Sun caught it and threw it from one of his hands to the other until it grew cold. Shortly after, Moon discovered the ornament in the hiding place where Sun had put it, and begged his brother to obtain a similar one for him. Somewhat reluctantly Sun led Moon to the woodpeckers, who agreed to supply another ornament. But as Sun was preparing to catch it, Moon insisted on doing so himself, in spite of the warnings uttered by his brother, who feared some disastrous accident. Moon was, as it happened, very clumsy. As Sun had predicted, the ornament burned his hands, and he let it fall to the ground; the entire savannah caught fire, and all the animals were burned.",18,God
Eskimo - Sun and Moon.txt,"Long ago a man and his wife lived in a village on the coast. They had two children, a girl and a boy. When the children grew up, the boy fell in love with his sister. He pursued her unceasingly with his attentions, so she finally took refuge in the sky, where she became the moon. Ever since then the boy has never stopped pursuing her, in the form of the sun. Sometimes he catches up with her and manages to embrace her, thus causing an eclipse of the moon. After the children left him, the father became gloomy and full of hatred toward humanity.9 He traveled across the world, scattering disease and death, and feeding off the people who fell victim to the diseases; but he became so evil that his desire could not be satisfied in this way. He then started to kill and eat healthy people, too.",18,Gid
Tsimshian - Nalq.txt,"In early times young people used to meet in the evening behind the houses. They used to amuse themselves by playing noisy games far into the night. The sky was irritated by the din and sent down a beautiful magic plume, which a young man tried to catch as it fell. But as soon as he caught it, he was carried off into the air; then in a long chain all the others were, too, since each one attempted to hold back the one in front by hanging on to his or her feet. All the people were taken up by the plume; and at last they fell, and all died. Not one of them survived. However, one young woman had remained indoors, because she had been in labor. She gave birth to a series of miraculous children. After telling them of the fate that had befallen their family, she warned them against playing outdoors. But they provoked the sky into sending down the plume again, and succeeded in catching it. Using it as a talisman, they embarked on a journey around the world, reached the city of the Air, and finally married the daughters of the winds of the four cardinal points; they settled how and when these winds should blow.",,
Caduveo - Birds.txt,"Three children used to play in front of the hut until past midnight. The father and mother paid no attention to them. One night when they were playing—it was very late—an earthenware pot descended from the sky; it was lavishly decorated and full of flowers. The children saw the flowers and wanted to take them, but as soon as they put out their arms, the flowers retreated to the other side of the pot, with the result that the children had to climb into the pot in order to reach them. The pot started to rise into the air. When she saw what was happening, the mother just managed to grab the leg of one of her children. The leg broke, and from the wound flowed a lake of blood in which most of the birds (whose plumage was at that time uniformly white) dipped either all or some of their feathers, thus acquiring the different-colored plumage they have today.",17,Birds
Arecuna - Fish Poison.txt,"Exasperated by her child's crying, a woman left him to the fox. The latter took him home, fed him, and brought him up, but a female tapir stole him. The child grew up completely covered in ticks, which are the tapir's beads. When he became a grown man, the female tapir took him as her husband. She taught him the different meanings that beings and things had for tapirs: the poisonous snake was an oven, but the dog was a poisonous snake. . . . It so happened that the female tapir, who had become pregnant, laid waste the plantation belonging to her husband's parents. Thereupon she urged him to visit his relatives but advised him to keep their marriage secret. The boy was warmly welcomed, but people expressed surprise at the fact that he was covered with ticks. He maintained that this was on account of his losing his way in the forest. The following morning it was discovered that the plantation had been ruined, and the tapir's tracks were noticed. It was decided to kill the tapir. The young man thereupon confessed that she was his wife, and that she was pregnant. They could kill her, provided they were careful not to wound her in the belly, but only under the arm, in the head, or the legs. And he asked his mother to follow the hunters, in order to remove the child from the animal's body as soon as it was dead. As the hero had also foretold, the mother discovered that every time she bathed the child in the river (in secret, following her son's injunctions), quantities of fish died. She therefore washed the child each time there was a shortage of food. But the hero's relatives (sisters' husbands) were curious about the mysterious glut of fish and sent children to spy on their mother-in-law. In this way they discovered the old woman's secret. From then on, the bathing and the collecting of the fish were to take place in public with everyone helping. In this way the fish-eating birds came to know that when the child was washed in the river, there would be a miraculous glut of fish. The tuyuyu bird (Mycteria mycteria, a wood ibis) asked the father to bathe the child for their benefit, and suggested that the operation should take place, not in a stream but in the pool below a waterfall where the fish were more plentiful. The father was frightened and protested, ""You will kill my child!"" But the bird was so insistent that, for the sake of peace, the father, the child, and the whole family went to inspect the pool. There they found the birds, who had arranged to assemble at the spot. The pool was found to be full of fish. The father ordered his son to dive in, but the latter was afraid of the deep and threatening water. The father insisted. Furious, the boy plunged into the water and dived over and over again. Then the father said to him, ""That is enough, my son! There are a lot of dead fish. Come back now!"" But the child was annoyed and refused to listen. The dead fish began to pile up. Finally, the swimmer reached a rock in the middle of the pool and lay there, face downward, without uttering a word. Now he was cold, for when he had dived into the water, he was burning with anger and covered in sweat. And while the men and the birds busied themselves gathering up the fish, he died without speaking. What had happened was that during one of his dives Keyemen—the rainbow in the shape of a huge watersnake—had shot him with an arrow and wounded him. Keyemen was the grandfather of aquatic birds, and the entrance to his subterranean abode was at the bottom of the pool where the fatal fishing expedition was taking place. Full of bitterness, Kulewente (this was the father's name) blamed the birds for his son's death and asked them to avenge it. The birds took turns in trying to dive down to the bottom of the pool, but without success. Then the terrestrial birds and quadrupeds tried, and they too failed. Two remaining birds (two diving birds, Colymbus species) stayed in the background, for they had made no request to the father and bore no responsibility for the boy's death. Nevertheless they agreed to intervene. They dived to the bottom of the pool and killed Keyemen. By means of a liana that they fastened round his neck, the men and the animals succeeded in hauling the monster onto dry land. They skinned the body and cut it into pieces, which they shared out among themselves. According to the nature and color of the portion allotted to each one, the animals acquired the cries, the anatomical peculiarities, the coats, or the plumage that were henceforth to be characteristic of each species. Kulewente put his son's body in a basket and then went off. The grandmother took the basket and walked away with it, singing. Blood oozed from the basket, then pieces of decomposed flesh fell out, creating timbo, from which fish poison is extracted. The bones and sexual organs produced the weak variety, and the rest of the body the strong variety. The grandmother finally turned into an ibis which eats the earthworms men use as bait in fishing. he white egret took its piece and sang, ""a-a,"" a call that it still has to this day. The maguari {Ciconia maguari, a stork) did likewise and uttered its ugly cry: ""a(o)-a(o)."" The soco (Ardea brasiliensis, a heron) placed its piece on its head and wings (where the colored feathers are) and sang, ""koro-koro-koro."" The kingfisher (Alcedo species) put its piece on its head and breast, where the feathers turned red, and sang, ""se-txe-txe-txe."" Then it was the toucan's turn. It covered its breast and belly (where the feathers are white and red). And it said: ""kion-he, he kion-he-he."" A small piece of skin remained stuck to its beak which became yellow. Then came the mutum; it put its piece on its throat and sang, ""hm-hm-hm-hm"" and a tiny remaining strip of skin turned its nostrils yellow. Next came the cujubim (a piping guan), whose piece turned its head, breast, and wings white: it sang, ""krr"" as it has done every morning since. Each bird ""thought its own flute made a pretty sound and kept it."" The richly colored plumage of the macaw is explained by the fact that it seized a large piece of skin and covered its whole body in it; it was imitated in this by the parrots and the yellow parakeets. The oazabaka bird acquired a charming song: ""oazabaka-oazabaka-ku-lu-lu-lu-lu."" And all the birds, including the jacu and the nightingale, received in this way their plumage and their ""flute."" Then came the turn of ground game—the tapir, the capybara, and the deer. Each one chose a piece of skin. The part the deer received as its share sprouted antlers. As a matter of fact, the antlers of the forest species formerly belonged to the savannah species, and vice versa: since the first were bothered by the size of their antlers because they became entangled in creepers and branches, the two species decided to swap. The agouti (Dasyprocta aguti) acquired reddish and white fur on its breast and belly, and its little ""flute"": ""king-king""; the paca {Coelogenys paca) likewise. The tapir was given its warning cry, which was like a whistle. The caititu {Dicotyles torquatus) placed the skin on its shoulders, which accounts for its black hair; and it also received its call ""hx-hx""; while the peccary ( = quiexada : Dicotyles labiatus) said ""rr-rr."" Finally, the great anteater (Myrmecophaga jubata) stretched the skin over its arms and spine where the fur became yellow, and was allotted the cry ""rr-rr"" (clearer than the gutteral and muted ""rr-rr"" of the peccary). Each species of monkey was also given a cry, and in this way all the wild animals obtained their colored coats and their ""flutes.""",16,FishPoison
Arawak - Birds.txt,"Men and birds joined forces to destroy the huge watersnake, which dragged all living creatures down to his lair. But the attackers took fright and cried off, one after the other, offering as their excuse that they could only fight on dry land. Finally, the duckler (K.G.: a diver) was brave enough to dive into the water; he inflicted a fatal wound on the monster which was at the bottom, coiled round the roots of an enormous tree. Uttering terrible cries, the men succeeded in bringing the snake out of the water, where they killed it and removed its skin. The duckler claimed the skin as the price of its victory. The Indian chiefs said ironically, ""By all means! Just take it away!"" ""With pleasure,"" replied the duckler as it signaled to the other birds. Together they swooped down and, each one taking a piece of the skin in its beak, flew off with it. The Indians were annoyed and angry and, from then on, became the enemies of birds.",17,Birds
