Title,Content,Cluster,Concept
Opaye.txt,"The women were busy collecting wood in a part of the forest that had been burned. One of them, who was still a girl, spotted the carcass of a queixada that a jaguar had left there. ""How I should love to be the jaguar's daughter!"" she exclaimed. ""I should get all the meat I wanted."" ""Nothing could be easier,"" replied the jaguar, appearing at that moment. ""Come with me. I will not hurt you."" The others looked for the girl in vain, and it was supposed that she had been devoured by the jaguar. But one day she came back and revealed her identity to her younger sister and her parents. She explained that with her husband the jaguar she wanted for nothing, and that he would be delighted to supply food to the Indians. ""What kind of game do you prefer?"" ""Anything!"" ""But state a preference. The jaguar will want to know."" ""All right. Tapir!"" ""Agreed,"" said the woman. ""But take care to see that the hut posts are strong. The jaguar will leave the meat on the roof."" The next day the father discovered that the roof was covered with well-grilled meat. They made a feast of it. Two days later the supply was renewed. After a time the jaguar wearied of carrying the meat and, through his wife, proposed that he should settle in the village. The father agreed. (He was afraid of the jaguar, but he was fond of meat.) Besides, the woman explained that the jaguar would not set up his hut too close to that of his parents-in-law; he would build it some distance away, so as not to be seen. The woman went away; she was beginning to know how to hunt as well as the jaguar. The next day the hut roof was covered with all kinds of meat: caititu, queixada, armadillo, and paca. The jaguar came to live with the Indians. His brother-in-law became friendly with the new couple who supplied him with choice game: jao, mutum, inhambu, and macuco. But the grandmother felt mistrust. The young woman was gradually turning into a beast of prey; black spots appeared on her body, and she grew claws on her hands and feet. Only her face remained human, although fangs were beginning to show in her mouth. The old woman therefore resorted to witchcraft and killed her granddaughter. The father was not very upset, but the whole family was afraid of the jaguar. His brother-in-law went to tell him that his wife was dead, and to ask him if he would take revenge or would agree to accept one of the dead woman's sisters in her place. ""No,"" replied the jaguar. ""There is no need for that. I shall leave. I do not wish you any harm. Perhaps you will remember me in years to come. . . ."" And the jaguar went off, incensed by the murder and spreading fear by his roaring; but the sound came from farther and farther away.",5,Pigs
Kayapo-KubenKranken.txt,"While camping on the outskirts of a village with his son, the culture hero O'oimbre sent the boy to ask for food from his mother's relatives. The boy was badly received, and as a revenge, O'oimbre made a charm with feathers and thorns and used it to change all the villagers into peccaries. They remained shut up in their huts as if they were pigsties; Takake, the brother-in-law and rival of O'oimbre, drew one of them out (by the means described in the preceding myth) and killed it. O'oimbre forced a confession from Takake's son, went to the pigsty and set the peccaries free.",5,Pigs
Bororo - Cera.txt,"Once upon a time the men of the Bokodori clan were supernatural spirits who lived happily in huts made of down and feathers, which were called ""macaws' nests."" When they wanted something, they would send one of their young brothers to their sister to ask her to obtain it for them from her husband. They expressed a desire for honey; the honey their brother-in-law invited them to eat in his hut was thick, sticky, and full of scum, because he had copulated with his wife while he was busy collecting it. The wife's brothers went away offended and decided to look on the river bed for the stone with which to pierce holes in palm-nut shells or the shells of shellfish—that is, for the technical means for the production of ornaments such as pendants and necklaces. They eventually discovered the stone and, with it, successfully carried out the work of piercing the holes. Success caused them to give a triumphant laugh, different from the laugh that expresses profane gaiety. Being curious to know the cause of the cries that she could hear from afar, the wife spied on her brothers and thus broke the rule forbidding her to look inside the feather hut. Because they had been insulted in this way, the Bokodori decided to put an end to their lives. First they solemnly shared out the ornaments between the various lineages, each ornament becoming an attribute of a particular lineage. Then they threw themselves simultaneously into a blazing fire (with the exception of their already married relatives, who were left to carry on the race). No sooner were they consumed by the fire than they changed into birds: red and yellow macaws, falcons, hawks, egrets. . . . The other inhabitants of the village decided to leave so somber a place. Only the sister would return regularly to the scene of the sacrifice to collect the plants growing among the ashes: urucu, cotton, and calabashes, which she shared out among her relatives.",19,Production
Cariri - Pigs - Tobacco.txt,"In the days when the demiurge lived with men, the latter asked him to let them taste wild pigs, which as yet did not exist. The Grandfather took advantage of the fact that all the Indians were away and had left only children under ten behind in the village, to change the latter into wild piglets. When the Indians returned, he advised them to go hunting, but at the same time sent all the piglets up into the sky by way of a big tree. The men, seeing this, followed the piglets into the sky and began killing them there. The demiurge thereupon ordered the ants to fell the tree, which the toads defended with their bodies. This is why today toads have swollen backs as a result of the stings. The ants succeeded in bringing down the tree. The Indians, being unable to get back to earth, put their belts end to end to make a rope. But as it was too short, they fell down one after another and broke their bones: ""This is why our fingers and toes are broken in so many places and why our bodies bend according to the breaks inflicted on our parents by their fall."" On returning to the village, the Indians feasted on the flesh of their children, who had been changed into piglets. They begged the Grandfather to come down from the sky (whither he had followed the children) and to return to the village: ""but he would not hear of it and gave them tobacco in his stead; they call it Badze and this is why, at certain times, they make offerings of tobacco.""",7,Tobacco
Bororo - Tobacco.txt,"Fishermen had settled themselves at the water's edge to grill their fish. One of them, with his knife, slit open the belly of a huddogo and discovered tobacco inside. He hid the fish and smoked only at night, without telling his companions. The latter smelled the aroma and caught him at it. He then decided to share the tobacco with them. But the Indians swallowed the smoke instead of blowing it out. ""That is not the way to smoke,"" said the supernatural spirit who appeared in the guise of a vampire. ""First, puff, saying, 'Grandfather, receive the smoke and keep evil away from me!' Otherwise, you will be punished, because this tobacco belongs to me."" The Indians did not obey; therefore, by the following morning they had become almost blind and had been changed into ariranhas. This is why these animals have such small eyes.",7,Tobacco
Matako - Jaguar.txt,"A man went fishing with Woman. Man climbed a tree to catch parrots, which he threw down to his Woman. But the Woman devoured the parrots. Man asked, ""Why are you eating the parrots?"" When man came down from the tree, Woman killed Man by breaking his neck with her teeth. When Woman returned to the village, her children ran toward her to see what the Woman was bringing. Woman showed them their father's head, saying that it was the head of an armadillo. During the night Woman ate her children and ran away. Woman changed herself into a jaguar. Jaguars are women.",6,Jaguar
Tereno-Tobacco.txt,"There was a Woman who was a sorceress. She defiled caraguata plants with menstrual blood. Woman served caraguata plants to her Man as food. The Man, having been told about this by his Son, announced that he was going to look for honey. After knocking the soles of his leather sandals together ""to find honey more easily,"" Man discovered a hive at the bottom of a tree and a snake. Man kept the pure honey for his Son, and for his Woman prepared a mixture composed of honey and the flesh of snake embryos taken from the belly of the one Man had killed. No sooner had the Woman begun to eat her portion than her body started to itch. As Woman scratched herself, she announced to her Man that Woman was about to devour Man. Man ran away and climbed to the top of a tree where there was a parrot's nest. He kept the Woman quiet temporarily by throwing to Woman the three nestlings, one after the other. While Woman was chasing the largest which was trying to flutter away from Woman, the Man ran off in the direction of a pit that he himself had dug for the purpose of catching game. Man avoided the pit, but the Woman fell into it and was killed. The Man filled in the hole and kept watch over it. An unknown plant eventually sprouted there. Out of curiosity the Man dried the leaves in the sun; at nightfall he smoked in great secret. Man's companions caught him at it and asked what he was doing. Thus it was that men came to have tobacco.",7,Tobacco
Bororo - Pigs.txt,"Day after day the Men would go fishing and catch nothing. Men would return to the village in a sad state of mind, not only because they were empty-handed, but also because their Women were sulking and gave them a poor welcome. The Women even got to the point of challenging the Men. Women declared that they would do the fishing. But in actual fact all Women did was to call on otters, who dived and fished in their stead. The Women returned laden with fish, and each time the Men tried to get their own back, Men caught nothing. After a time the Men suspected some sort of trick. They had the Women spied on by a Bird who revealed the truth. The next day, the Men went to the river, called the Otters, and strangled them one after another. Only one escaped. It was now the Men's turn to jeer at the Women, who caught nothing. The Women therefore determined to be avenged. Women offered Men a drink made with piqui fruits, whose kernels they had left covered with spikes. Choked by these spikes which stuck in their throats, the Men grunted, and were changed into wild pigs that give this cry.",5,Pigs
Tobo-Pilaga - Tobacco.txt,"One day a Woman and her Man went to catch parakeets. The Man climbed a tree containing several nests and threw down thirty or so fledglings to his Woman. He noticed that Woman gobbled them up. Seized with fear, Man caught hold of a larger bird and, as Man threw it down, called out, ""Here comes a fledgling, but look out, it can fly."" The Woman ran after the bird, and the Man took advantage of the situation to climb down and run away: Man was afraid Woman might eat him, too. But his Woman went after him, caught up with Man, and killed him. Then Woman cut off Man's head, which she put in a bag, and feasted on the rest of the body until her stomach was full. Woman had scarcely returned to the village when she felt thirsty. Before going to the drinking pool, which was some distance away, Woman forbade her five children to touch the bag. But the youngest immediately looked inside and called the others, who recognized their father. The whole village was now informed, and everybody took fright and ran away, except the children. When the Woman, on her return, was surprised to find the village empty, they explained that the villagers had left after insulting them, having fled through shame at their own spitefulness. The Woman was indignant and, wishing to avenge her children, went after the villagers. Woman caught up with them, killed a number of them, and devoured the bodies there and then. The same process was repeated several times. Terrified by these bloody comings and goings, the children wanted to escape. ""Do not try to run away,"" said the Woman, ""lest I eat you, too."" The children implored her. ""No, don't be afraid,"" Woman replied. No one was able to kill Woman, and the rumor soon spread that she was a jaguar-woman. The children secretly dug a pit, which they covered with branches. They took flight when their mother announced to them that their turn had now come to be eaten. Woman rushed after them and fell into the trap. The children went to ask for help from Carancho (the culture hero, a species of falcon, simultaneously a bird of prey and a carrion-eater), who advised them to hollow out a tree trunk and hide inside with him. The jaguar-woman tried to tear the tree with her claws, but they remained caught in the wood, so that Carancho was able to come out and kill her. Her corpse was burned on a woodpile. Four or five days later a plant sprang up from the ashes. This was the first appearance of tobacco. The claws were used to make collars for dogs, which were sent to all the villages, so that no one would be in doubt about the death of the jaguar-woman.",7,Tobacco
Warao - Stars.txt,"Once upon a time there were two brothers, the elder Man was a celebrated hunter. Each day he went a little farther afield in search of game, with the result that finally he came to a creek he had never seen before. He climbed into a tree standing at its edge so as to watch for the animals that came to drink. Suddenly he saw a Woman wading through the water toward him, and he thought her behavior very curious. Each time Woman put her hand into the creek Woman brought out two fish, and each time Woman ate one of them and put the other into her basket. Woman was a very big Woman, a supernatural being. On her head Woman was wearing a calabash, which Woman occasionally took off and threw into the water in such a way as to make it spin like a top. When Woman did this, Woman would stop to watch it, and afterward Woman would walk on again. The hunter spent the night up the tree and returned to the village the next day. Man told the story to his young Man, who begged to go with him in order to see ""such a Woman who can catch so many fish and can eat them as well."" ""No,"" was the reply, ""because you are always laughing at everything, and you might laugh at her."" But the young man promised to keep a straight face, and the elder Man allowed himself to be persuaded. When they reached the stream, the elder Man climbed into his tree, which stood a little way back from the edge; the younger one insisted on taking up his position in a better-placed tree, so as to miss nothing, and Man sat on a branch overhanging the water. The Woman soon arrived and began behaving as before. When Woman reached the spot directly beneath the young Man, Woman noticed the reflection of his shadow in the water. Woman tried to catch hold of it, and when Woman failed, kept on trying: ""Woman put her hand in quickly, first to this side and then that, but of course Woman did not succeed, and what with all her queer gesticulations and funny capers made so ridiculous an appearance that the Man up above could not resist laughing at her vain attempts to seize the substance for the shadow. Man laughed and laughed and could not stop laughing."" Thereupon the Woman looked up and spied the two Mans. Furious at having been laughed at, Woman launched an attack with poisonous ants; they bit and stung the boy so badly that, to escape from them, Man had to throw himself into the water, where the Woman caught him and ate him. Afterward Woman captured the other Man and put him in her well-secured basket. On returning to her hut, Woman put the basket down and forbade her two daughters to touch it. But as soon as her back was turned, her daughters lost no time in opening it. They were delighted with the hero's physical appearance and his talents as a hunter. Both of them, indeed, fell in love with him, and the younger one hid him in her hammock. When the time came for the ogress to kill and eat her prisoner, the daughters confessed their misdeeds. Their mother agreed to spare her unexpected son-in-law, on condition that Man go fishing on her behalf. But however big the catch Man brought back, the ogress would devour it all, apart from two fish. Eventually the hero was so worn out that Man fell ill. The younger daughter, who was by now his wife, agreed to run away with him. One day Man told his mother-in-law that Man had left his catch in his canoe, and that Woman should go and fetch it (a fisherman was not supposed to carry the fish himself, since this would spoil his luck). However, Man had arranged for a shark, or an alligator, to be under the canoe, and the ogress was devoured. The elder daughter discovered the murder, sharpened her knife, and pursued the culprit. When Woman was about to catch up with him, Man ordered his wife to climb a tree, and followed after her. But Man was not quick enough to prevent his sister-in-law cutting off one of his legs. The detached member sprang to life and became the mother of birds. You can still see, in the night sky, the hero's wife (the Pleiades); lower down, the hero himself (the Hyades) and, lower still, his severed leg—Orion's belt.",8,Stars
Bororo - Stars.txt,"The Women had gone to gather maize, but Women did not succeed in finding very much, so Women took a little Boy with them who found a great many corncobs. Women pounded the maize there and then to make different sorts of cakes for the men when Men returned from hunting. The little Boy stole enormous quantities of the corn which he hid in bamboo tubes and brought to Grandmother, with the request that she would make a comcake for himself and his friends. The Grandmother did as she was asked, and the children had a feast, after which, to keep the theft secret, they cut out the tongues of the Grandmother and of a tame macaw and set free all the macaws that were being raised in the village. Fearing their parents' anger, Children fled into the sky by climbing up a knotty creeper that the hummingbird had agreed to fasten in position. Meanwhile the Women came back to the village and looked for the children. Women questioned the tongueless Grandmother and macaw to no purpose. One of Women caught sight of the creeper with the Children climbing up it. When pressed to come down, the Children turned a deaf ear and even climbed still faster. The distraught mothers went up after them, but the little Boy (thief), who was the last child, cut the creeper as soon as he reached the sky; the Women fell and crashed onto the ground, where Women were changed into animals and wild beasts. As a punishment for their heartlessness, the Children, now transformed into stars, look down every night on the sad plight of their mothers. It is the Children's eyes that can be seen shining.",8,Stars
Mataco - Woman.txt,"Once upon a time, Men were animals who could speak. Men had no Women, and Men lived on fish which Men caught in great quantities. One day Men noticed that their supplies of food had been stolen, so Men left a parrot on guard. The bird, from its perch at the top of a tree, saw Women coming down from the sky by the means of a rope. Women ate as much as they could and went to sleep in the shade of the tree. Instead of giving the alarm as he had been instructed to do, the parrot began to throw pieces of wood at the Women, who woke up and discovered him. Women bombarded Parrot with seeds, one of which hit the bird's tongue, which has been black ever since. The iguana heard the sound of the fight and informed his companions; but believing him to be deaf, they refused to pay any attention. The parrot meanwhile had been struck dumb. The next day the lizard mounted guard, but the Women captured him and tore out his tongue, so that he, too, was struck dumb. The Men, after a discussion, entrusted the village to the care of the hawk, which could not be seen by the Women because the color of its plumage was indistinguishable from that of the trunk of the tree in which it was perched. The hawk gave the alarm; although the Women threw things at him, he nevertheless managed to cut the rope. Henceforth the Men were provided with Women.",9,Woman
Toba-Pilaga - Woman.txt,"Formerly Men used to hunt and store their supply of game on the thatched roofs of their huts. One day, in Men's absence, a group of Women came down from the sky and stole all the meat. The same thing happened the next day, and the Men, who did not know that Women existed, set Rabbit to watch. But Rabbit slept all the time, and the grilled meat was stolen. The next day Parrot stood guard, hidden in a quebracho tree, and he saw the Women, who had toothed vaginas. After remaining quiet and motionless at first, Parrot threw a fruit down from the tree onto the Women who were feasting below. The Women began by accusing each other; then they discovered Parrot and began to fight about whose husband he should be. Women threw things at each other, and one of the sticks went astray and broke the bone under the parrot's tongue. Being now struck dumb and compelled to express himself through gestures, Parrot could not make the Men understand what had happened. It was now Hawk's turn to mount guard, and Hawk took care to arm himself with two throwing sticks. The first missed its target and enabled the Women to discover him; but although Women fought with each other about who should have him as husband and then tried in vain to kill him by throwing things at him, with his second stick Hawk succeeded in cutting one of the two ropes used by the Women to travel up and down from the sky (one rope was for pretty Women with fair complexions, the other for old, ugly ones). Several Women fell down and sank into the earth, but not before Hawk had captured two Women for his own use. Hawk then called to his Men. Only Iguana could hear him, but since Iguana had very small ears, the other Men refused to admit that his hearing could be keener than theirs. Eventually Hawk managed to make himself audible to Men. . . . Armadillo extracted the Women from the earth and distributed them among Men.",9,Woman
Chamacoco - Woman.txt,"Once when a young Chamacoco Son was ill and lying in his hammock, Son caught a glimpse of his Mother's vagina as she climbed over the roof of the hut to repair it. Inflamed with desire, Son waited until Mother came down again, and then made love to her. Then Son was indiscreet enough to reveal to her the secret of the masks, which women are not supposed to know about, and Mother told it to the other Women. When the Men realized what had happened, they killed all the Women but one, who changed into a deer and managed to escape. But though Men performed all the Women's work, Men were sad and depressed because they lacked Women. One day a Man walked under the tree in which the surviving woman happened to be. Woman spat to attract his attention. The Man tried to climb the tree but was hampered in the ascent by the fact that he had an erection; he gave up but not before he had spilled sperm all over the trunk. The other Men came on the scene and managed to reach the Woman from the neighboring trees. They raped her and then cut her into pieces which became soaked with sperm as they fell to the ground. Each Man picked up a piece and took it home. Then they all went fishing. Two shamans, who were sent ahead as scouts, both claimed that vultures had devoured the pieces of Woman flesh. The Indians then came back to the village which they found inhabited by Women and children. Each man found himself with a Wife corresponding to his piece of flesh. The pieces of thigh provided fat Women; the fingers, lean ones.",9,Woman
Sherente  - Woman.txt,"In the beginning there were no Women, and Men practiced homosexuality. One of them became pregnant but was unable to give birth, and died. Once several Men, reaching a spring, saw in it the reflection of a Woman who was sitting high up in the branches of a tree. For two days they tried to catch the reflection. At last one of them looked up and spied the Woman; they brought Woman down, but since each wanted to have Woman, they cut Woman into little pieces which were shared out. Each Man wrapped his piece in a leaf and put the bundle in the grass wall of his hut. Then all Men went hunting. On their way back they sent ahead a Messenger who discovered that the pieces had all changed into Women. The puma, who had been given a piece from the chest, found himself with a very pretty Woman; the semema, who had twisted his slice too tight, found himself with a very lean Woman. But each Man now had a Woman; and when Men went hunting, they took their Women along.",9,Woman
Toba-Pilaga - Animals.txt,The demiurge Nedamik subjected the first humans to an ordeal by tickling. Humans who laughed were changed into land or water animals: the Humans that didn't laugh were preyed upon by the jaguar; the Humans that didn't laugh were able to escape from Nedamik by taking refuge in the water. Those humans who maintained self-control became jaguars or men who hunted jaguars and got the better of Humans who laughed.,10,Animal
